{
  "artifact_type": "run_card",
  "created_at": "2026-07-28T18:47:09Z",
  "created_by": {
    "code_commit": "3ac9e232ca1d91965554dc33c5cdebbf73c8a4d0",
    "entrypoint": "interplab.jobs.sync_registry",
    "host": "local",
    "run_id": "r20260728-1847-bd48"
  },
  "payload": {
    "config_hash": "sha256:34b7bdc9311c090126f22f3f1ba4bbeaea8fa4a4fbbb9a545dbdddd82623a493",
    "config_ref": "local:configs/sync_registry.yaml",
    "exit_code": 0,
    "inputs": [],
    "log_section": null,
    "outcome_line": "synced 0 artifact(s) from outbox",
    "outputs": [],
    "run_id": "r20260728-1847-bd48",
    "slurm": null,
    "stage": "sync",
    "status": "completed"
  },
  "schema_version": 1,
  "self_hash": "sha256:90cd68eaf8cc81bfa672e8655325eb528b66fda83bec02c13c90257f48d1471e",
  "subject": []
}
